{
  "schemaVersion": "1.0.0",
  "aggregateVersion": "1.0.0",
  "datasetId": "devcal-initial-24",
  "datasetRevision": 0,
  "reviewMode": "developer_self_review",
  "validationLevel": "not_expert_validated",
  "createdAt": "2026-08-11T15:00:00.000Z",
  "updatedAt": "2026-08-14T11:31:56.040Z",
  "sectorPlan": [
    { "sector": "commerce", "requiredSlotCount": 4 },
    { "sector": "finance", "requiredSlotCount": 4 },
    { "sector": "online_platform", "requiredSlotCount": 4 },
    { "sector": "telecom", "requiredSlotCount": 4 },
    { "sector": "healthcare", "requiredSlotCount": 4 },
    { "sector": "education", "requiredSlotCount": 4 }
  ],
  "pins": {
    "analyzerVersion": "KR-PRIVACY-2026.08.11-r4",
    "rulesetVersion": "KR-PRIVACY-2026.08.11-r4",
    "analyzerSourceSha256": "sha256:538390c82af4a46e5e4fedee7b2c000d5719a758ecb7010f36a61ad214e5ce10",
    "ruleCatalogSha256": "sha256:473e23d5a81fa5484b9d804c1817990dec4504c86ce5dd89f5704d3adfe0b2af",
    "legalRuntimeManifestSha256": "sha256:7c616fad01bc0501255e7019c92561dc00566b874ac4b8eee10dec5407acd7d8",
    "legalSourceSnapshotSha256": "sha256:b515f63e95957491397c35a9a201ca633d7fb4c6b49bbb5721af53d9a33a3204"
  },
  "legalCohort": null,
  "slots": [
    { "slotId": "slot-01", "sector": "commerce", "status": "unassigned", "caseReview": null },
    { "slotId": "slot-02", "sector": "commerce", "status": "unassigned", "caseReview": null },
    { "slotId": "slot-03", "sector": "commerce", "status": "unassigned", "caseReview": null },
    { "slotId": "slot-04", "sector": "commerce", "status": "unassigned", "caseReview": null },
    { "slotId": "slot-05", "sector": "finance", "status": "unassigned", "caseReview": null },
    { "slotId": "slot-06", "sector": "finance", "status": "unassigned", "caseReview": null },
    { "slotId": "slot-07", "sector": "finance", "status": "unassigned", "caseReview": null },
    { "slotId": "slot-08", "sector": "finance", "status": "unassigned", "caseReview": null },
    { "slotId": "slot-09", "sector": "online_platform", "status": "unassigned", "caseReview": null },
    { "slotId": "slot-10", "sector": "online_platform", "status": "unassigned", "caseReview": null },
    { "slotId": "slot-11", "sector": "online_platform", "status": "unassigned", "caseReview": null },
    { "slotId": "slot-12", "sector": "online_platform", "status": "unassigned", "caseReview": null },
    { "slotId": "slot-13", "sector": "telecom", "status": "unassigned", "caseReview": null },
    { "slotId": "slot-14", "sector": "telecom", "status": "unassigned", "caseReview": null },
    { "slotId": "slot-15", "sector": "telecom", "status": "unassigned", "caseReview": null },
    { "slotId": "slot-16", "sector": "telecom", "status": "unassigned", "caseReview": null },
    { "slotId": "slot-17", "sector": "healthcare", "status": "unassigned", "caseReview": null },
    { "slotId": "slot-18", "sector": "healthcare", "status": "unassigned", "caseReview": null },
    { "slotId": "slot-19", "sector": "healthcare", "status": "unassigned", "caseReview": null },
    { "slotId": "slot-20", "sector": "healthcare", "status": "unassigned", "caseReview": null },
    { "slotId": "slot-21", "sector": "education", "status": "unassigned", "caseReview": null },
    { "slotId": "slot-22", "sector": "education", "status": "unassigned", "caseReview": null },
    { "slotId": "slot-23", "sector": "education", "status": "unassigned", "caseReview": null },
    { "slotId": "slot-24", "sector": "education", "status": "unassigned", "caseReview": null }
  ],
  "aggregate": {
    "aggregateVersion": "1.0.0",
    "datasetRevision": 0,
    "calibrationCounts": {
      "totalSlots": 24,
      "unassignedSlots": 24,
      "inReviewSlots": 0,
      "completedSlots": 0,
      "findingDecisions": 0,
      "confirmed": 0,
      "falsePositive": 0,
      "uncertain": 0,
      "evidenceAssessments": { "supported": 0, "unsupported": 0, "uncertain": 0 },
      "legalBasisAssessments": { "supported": 0, "unsupported": 0, "uncertain": 0 },
      "manualMissedFindings": 0,
      "omissionEligibleSlotsWithMisses": 0,
      "omissionEligibleCompletedSlots": 0
    },
    "calibrationRates": {
      "slotCompletionRate": 0,
      "findingConfirmationRate": null,
      "falsePositiveRate": null,
      "uncertainDecisionRate": null,
      "evidenceSupportRate": null,
      "legalBasisSupportRate": null,
      "omissionCheckedSlotMissRate": null
    }
  }
}
